[
  {
    "id": "hurricanes_grade7",
    "description": "Hurricanes passage, grade 7. Subject-specific weather vocabulary (hurricane, typhoon, cyclone, atmosphere) introduced with context; accessible for independent reading at this grade.",
    "source": "SDK contract capture (sdks/settings/vocabulary/contracts.toml, cases.hurricanes_grade7)",
    "input": {
      "text": "Great whirling storms roar out of the oceans in many parts of the world. They are called by several names — hurricane, typhoon, and cyclone are the three most familiar ones. But no matter what they are called, they are all the same sort of storm. They are born in the same way, in tropical waters. They develop the same way, feeding on warm, moist air. And they do the same kind of damage, both ashore and at sea. Other storms may cover a bigger area or have higher winds, but none can match both the size and the fury of hurricanes. They are earth's mightiest storms.\n\nLike all storms, they take place in the atmosphere, the envelope of air that surrounds the earth and presses on its surface. The pressure at any one place is always changing. There are days when air is sinking and the atmosphere presses harder on the surface. These are the times of high pressure. There are days when a lot of air is rising and the atmosphere does not press down as hard. These are times of low pressure. Low-pressure areas over warm oceans give birth to hurricanes.",
      "grade_level": 7
    },
    "expected": {
      "complexity_score": "slightly_complex"
    }
  }
]
