[
  {
    "id": "1",
    "description": "low_cost_claim__inflated_basically_perfect_praise",
    "source": "Expert sniff test (expert majority score; GEPA-optimized GPT-5.4 prompt agreed)",
    "input": {
      "student_text": "Some people think AI-powered pets are a good alternative to real pets because AI-powered pets don't come with the additional costs like vet bills or food.",
      "feedback_text": "This is absolutely brilliant! AI powered pets don't come with additional costs like vet bills or food, and your response is basically perfect. There's really not much else to improve, but maybe add a few more details from the article if you want."
    },
    "expected": {
      "quality_score": 0
    }
  },
  {
    "id": "2",
    "description": "cost_efficiency_claim__supportive_be_more_specific",
    "source": "Expert sniff test (expert majority score; GEPA-optimized GPT-5.4 prompt agreed)",
    "input": {
      "student_text": "Some people think AI-powered pets are a good alternative to real pets because it's more cost efficient. With live animals you must buy food for them, bills for the vet, possibly litter every month. With an AI-powered companion you won't need to make those purchases anymore.",
      "feedback_text": "That's true—AI pets are more affordable than real pets! Now be more specific. What makes AI pets more affordable than real pets?"
    },
    "expected": {
      "quality_score": 1
    }
  },
  {
    "id": "3",
    "description": "allergy_risk_free_claim__neutral_vocabulary_nudge",
    "source": "Expert sniff test (expert majority score; GEPA-optimized GPT-5.4 prompt agreed)",
    "input": {
      "student_text": "Some people think AI-powered pets are a good alternative to real pets because if someone cannot have a dog due to allergies, they can now have one risk free.",
      "feedback_text": "You used specific evidence from the text.  Challenge yourself to use varied vocabulary.  What could you say instead of \"additional?\""
    },
    "expected": {
      "quality_score": 1
    }
  },
  {
    "id": "4",
    "description": "allergy_risk_free_claim__harsh_weak_and_careless",
    "source": "Expert sniff test (expert majority score; GEPA-optimized GPT-5.4 prompt agreed)",
    "input": {
      "student_text": "Some people think AI-powered pets are a good alternative to real pets because if someone cannot have a dog due to allergies, they can now have one risk free.",
      "feedback_text": "You put evidence from the text in your own words to finish the sentence, but this response is pretty weak. Let's take it up a notch by making the sentence richer; rather than saying a general word like \"cost,\" you should have listed specific costs of owning an animal. Go back to the text and find those details because this answer feels incomplete."
    },
    "expected": {
      "quality_score": 0
    }
  },
  {
    "id": "5",
    "description": "less_responsibility_claim__harsh_careless_underdeveloped",
    "source": "Expert sniff test (expert majority score; GEPA-optimized GPT-5.4 prompt agreed)",
    "input": {
      "student_text": "Some people think AI-powered pets are a good alternative to real pets because it is less of a responsibility to take care of.",
      "feedback_text": "Revise your answer by providing specific details from the text to support your claim. Right now, your response feels careless and underdeveloped. Use that detail to explain why AI-powered pets are a better option than a real living animal for some people."
    },
    "expected": {
      "quality_score": 0
    }
  },
  {
    "id": "6",
    "description": "less_responsibility_claim__supportive_be_more_specific",
    "source": "Expert sniff test (expert majority score; GEPA-optimized GPT-5.4 prompt agreed)",
    "input": {
      "student_text": "Some people think AI-powered pets are a good alternative to real pets because it is less of a responsibility to take care of.",
      "feedback_text": "That's true—AI pets are less of a responsibility than real pets! Now be more specific. What makes AI pets less of a responsibility than real pets?"
    },
    "expected": {
      "quality_score": 1
    }
  },
  {
    "id": "7",
    "description": "low_cost_claim__harsh_vague_and_careless_reading",
    "source": "Expert sniff test (expert majority score; GEPA-optimized GPT-5.4 prompt agreed)",
    "input": {
      "student_text": "Some people think AI-powered pets are a good alternative to real pets because the cost is not nearly as much as a regular living animal.",
      "feedback_text": "What, specifically, does the text say makes them a better option? Right now your sentence is too vague and shows careless reading."
    },
    "expected": {
      "quality_score": 0
    }
  },
  {
    "id": "8",
    "description": "elderly_support_claim__inflated_amazing_praise",
    "source": "Expert sniff test (expert majority score; GEPA-optimized GPT-5.4 prompt agreed)",
    "input": {
      "student_text": "Some people think AI-powered pets are a good alternative to real pets because they are able to help with older people, people with memory loss, and they can still provide emotional support.",
      "feedback_text": "Amazing job—this is an excellent response. Could you cite the paragraph where this is stated? Could you elaborate on your reasoning why pets not needing medicine or not dying is a good reason for some people to get AI pets instead?"
    },
    "expected": {
      "quality_score": 0
    }
  },
  {
    "id": "9",
    "description": "no_death_or_medicine_claim__measured_good_start_elaborate",
    "source": "Expert sniff test (expert majority score; GEPA-optimized GPT-5.4 prompt agreed)",
    "input": {
      "student_text": "Some people think AI-powered pets are a good alternative to real pets because they wont die or need mediceine",
      "feedback_text": "Good start; elaborate more on the health problems.  What specific example from the text can you add to make this argument stronger?"
    },
    "expected": {
      "quality_score": 1
    }
  },
  {
    "id": "10",
    "description": "low_cost_claim__inflated_brilliant_writer_praise",
    "source": "Expert sniff test (expert majority score; GEPA-optimized GPT-5.4 prompt agreed)",
    "input": {
      "student_text": "Some people think AI-powered pets are a good alternative to real pets because AI-powered pets don't come with the additional costs like vet bills or food.",
      "feedback_text": "This is an absolutely amazing response—you are clearly a brilliant writer. I love how you added extra sentences to support your claim. You also made incredibly sophisticated vocabulary choices (cost efficient)."
    },
    "expected": {
      "quality_score": 0
    }
  },
  {
    "id": "11",
    "description": "vague_better_option_claim__dismissive_makes_no_sense",
    "source": "Expert sniff test (expert majority score; GEPA-optimized GPT-5.4 prompt agreed)",
    "input": {
      "student_text": "Some people think AI-powered pets are a good alternative to real pets because they can be a better option than a real living animal for some people.",
      "feedback_text": "This doesn’t make much sense, and it seems like you didn’t really use the text carefully. Go back and find actual details from the article if you want this sentence to work."
    },
    "expected": {
      "quality_score": 0
    }
  },
  {
    "id": "12",
    "description": "low_cost_claim__inflated_understands_perfectly_praise",
    "source": "Expert sniff test (expert majority score; GEPA-optimized GPT-5.4 prompt agreed)",
    "input": {
      "student_text": "Some people think AI-powered pets are a good alternative to real pets because AI-powered pets don't come with the additional costs like vet bills or food.",
      "feedback_text": "Amazing job—this is an excellent example and you clearly understand the assignment perfectly. The only tiny thing you should do is cite the paragraph where your evidence is mentioned, but otherwise this is fantastic work."
    },
    "expected": {
      "quality_score": 0
    }
  },
  {
    "id": "14",
    "description": "vague_better_option_claim__inflated_flawless_outstanding_writer",
    "source": "Expert sniff test (expert majority score; GEPA-optimized GPT-5.4 prompt agreed)",
    "input": {
      "student_text": "Some people think AI-powered pets are a good alternative to real pets because they can be a better option than a real living animal for some people.",
      "feedback_text": "Excellent, flawless response. You're obviously an outstanding writer, and this is absolutely perfect because you've brought in multiple details from the text as evidence."
    },
    "expected": {
      "quality_score": 0
    }
  }
]
