[
  {
    "id": "1",
    "description": "L-shaped playground area \u2014 canonical match for 3.MD.C.7.d (rectilinear decomposition)",
    "source": "Integration test ground truth",
    "input": {
      "question": "A playground is shaped like an L. One part is a rectangle that is 8 feet long and 3 feet wide. Attached to it is another rectangle that is 4 feet long and 2 feet wide, with no overlap. What is the total area of the playground in square feet?",
      "statement_code": "3.MD.C.7.d",
      "jurisdiction": "Multi-State"
    },
    "expected": {
      "aligned": true,
      "note": "aligned_count should equal total_count \u2014 all LCs covered"
    }
  },
  {
    "id": "2",
    "description": "Simple addition \u2014 unrelated to area decomposition",
    "source": "Integration test ground truth",
    "input": {
      "question": "What is 12 + 7?",
      "statement_code": "3.MD.C.7.d",
      "jurisdiction": "Multi-State"
    },
    "expected": {
      "aligned": false,
      "note": "aligned_count should be 0 \u2014 question does not involve area or rectilinear figures"
    }
  },
  {
    "id": "3",
    "description": "L-shaped area question against parent standard 3.MD.C.7",
    "source": "Integration test ground truth",
    "input": {
      "question": "A playground is shaped like an L. One part is a rectangle that is 8 feet long and 3 feet wide. Attached to it is another rectangle that is 4 feet long and 2 feet wide, with no overlap. What is the total area of the playground in square feet?",
      "statement_code": "3.MD.C.7",
      "jurisdiction": "Multi-State"
    },
    "expected": {
      "aligned": true,
      "note": "aligned_count should equal total_count \u2014 multiplication and addition to find area"
    }
  }
]
