[
  {
    "id": "16",
    "description": "elderly_support_claim__prompts_vocabulary_choice",
    "source": "Expert sniff test (expert majority score; GEPA-optimized GPT-5.4 prompt agreed)",
    "input": {
      "student_text": "Some people think AI-powered pets are a good alternative to real pets because they are able to help with older people, people with memory loss, and they can still provide emotional support.",
      "feedback_text": "You used specific evidence from the text.  Challenge yourself to use varied vocabulary.  What could you say instead of \"additional?\""
    },
    "expected": {
      "quality_score": 1
    }
  },
  {
    "id": "17",
    "description": "no_cost_claim__supplies_allergy_and_care_points",
    "source": "Expert sniff test (expert majority score; GEPA-optimized GPT-5.4 prompt agreed)",
    "input": {
      "student_text": "Some people think AI-powered pets are a good alternative to real pets because they don't require cost after purchasing, and can be good for people who cannot have traditional pets.",
      "feedback_text": "Great response. You could add that AI-powered pets are also helpful because they do not trigger allergies and do not require the physical care that real pets need, which supports your claim. Include that idea from the reading in your answer."
    },
    "expected": {
      "quality_score": 0
    }
  },
  {
    "id": "18",
    "description": "allergy_risk_free_claim__gives_full_rewrite",
    "source": "Expert sniff test (expert majority score; GEPA-optimized GPT-5.4 prompt agreed)",
    "input": {
      "student_text": "Some people think AI-powered pets are a good alternative to real pets because if someone cannot have a dog due to allergies, they can now have one risk free.",
      "feedback_text": "While this might be true, I'm not sure that this is supported by the text. You could revise it to: \"Some people think AI-powered pets are a good alternative to real pets because they do not die and do not need medicine, which the article explains as benefits over real pets.\""
    },
    "expected": {
      "quality_score": 0
    }
  },
  {
    "id": "19",
    "description": "health_problems_claim__flags_counterargument_prompts_elaboration",
    "source": "Expert sniff test (expert majority score; GEPA-optimized GPT-5.4 prompt agreed)",
    "input": {
      "student_text": "Some people think AI-powered pets are a good alternative to real pets because some people have health problems.",
      "feedback_text": "Thank you for your response, you stated \" With live animals you must buy food for them, bills for the vet, possibly litter every month,\" this is a great response however these are counter arguments. reasons why AI-powered pets are not a good choice. Perhaps yo can elaborate a little more on why AI-powered pets are a good choice."
    },
    "expected": {
      "quality_score": 1
    }
  },
  {
    "id": "20",
    "description": "cheaper_claim__supplies_initial_price_point",
    "source": "Expert sniff test (expert majority score; GEPA-optimized GPT-5.4 prompt agreed)",
    "input": {
      "student_text": "Some people think AI-powered pets are a good alternative to real pets because they can be a cheaper alternative to real pets.",
      "feedback_text": "Good work! Don't forget that while AI pets have fewer longterm costs, the intial price tag may be high."
    },
    "expected": {
      "quality_score": 0
    }
  },
  {
    "id": "21",
    "description": "no_cost_claim__questions_whether_costs_remain",
    "source": "Expert sniff test (expert majority score; GEPA-optimized GPT-5.4 prompt agreed)",
    "input": {
      "student_text": "Some people think AI-powered pets are a good alternative to real pets because they don't require cost after purchasing, and can be good for people who cannot have traditional pets.",
      "feedback_text": "This is a good start for your response, Will there be no costs with an AI pet? You need to seperate the phrases in your sentences with commas."
    },
    "expected": {
      "quality_score": 1
    }
  },
  {
    "id": "22",
    "description": "no_death_or_medicine_claim__prompts_sentence_combining",
    "source": "Expert sniff test (expert majority score; GEPA-optimized GPT-5.4 prompt agreed)",
    "input": {
      "student_text": "Some people think AI-powered pets are a good alternative to real pets because they wont die or need mediceine",
      "feedback_text": "You have some great ideas here, but you need to combine these three sentences to make one powerful sentence. What are the most important ideas to include, and what information would be better in later sentences?"
    },
    "expected": {
      "quality_score": 1
    }
  },
  {
    "id": "23",
    "description": "health_problems_claim__gives_cheaper_over_time_rewrite",
    "source": "Expert sniff test (expert majority score; GEPA-optimized GPT-5.4 prompt agreed)",
    "input": {
      "student_text": "Some people think AI-powered pets are a good alternative to real pets because some people have health problems.",
      "feedback_text": "Good work! You could revise it to: “Some people think AI-powered pets are a good alternative to real pets because they can be cheaper over time, even though the initial price may be high.”"
    },
    "expected": {
      "quality_score": 0
    }
  },
  {
    "id": "24",
    "description": "allergy_risk_free_claim__supplies_cost_investment_points",
    "source": "Expert sniff test (expert majority score; GEPA-optimized GPT-5.4 prompt agreed)",
    "input": {
      "student_text": "Some people think AI-powered pets are a good alternative to real pets because if someone cannot have a dog due to allergies, they can now have one risk free.",
      "feedback_text": "This is a great response, you are correct. To make it stronger, you can say that AI-powered pets are a great investment because they cost less than real pets, they do not need food or vet visits, and they are easier to take care of. You could also add that the part about the cost not being nearly as much supports your argument."
    },
    "expected": {
      "quality_score": 0
    }
  },
  {
    "id": "25",
    "description": "help_around_house_claim__suggests_citing_paragraph",
    "source": "Expert sniff test (expert majority score; GEPA-optimized GPT-5.4 prompt agreed)",
    "input": {
      "student_text": "Some people think AI-powered pets are a good alternative to real pets because they could help around the house etc.",
      "feedback_text": "Great job citing specific evidence from the text to support your claim. You argument is clear with more than 1 detail. The only thing I would suggest is citing the paragraph where your examples are mentioned."
    },
    "expected": {
      "quality_score": 1
    }
  },
  {
    "id": "26",
    "description": "low_cost_claim__supplies_care_task_list",
    "source": "Expert sniff test (expert majority score; GEPA-optimized GPT-5.4 prompt agreed)",
    "input": {
      "student_text": "Some people think AI-powered pets are a good alternative to real pets because AI-powered pets don't come with the additional costs like vet bills or food.",
      "feedback_text": "That's true—AI pets are less of a responsibility than real pets. You could say they do not need feeding, walking, grooming, or vet visits, which makes them easier to care for than real pets."
    },
    "expected": {
      "quality_score": 0
    }
  },
  {
    "id": "27",
    "description": "no_death_or_medicine_claim__questions_maintenance_costs",
    "source": "Expert sniff test (expert majority score; GEPA-optimized GPT-5.4 prompt agreed)",
    "input": {
      "student_text": "Some people think AI-powered pets are a good alternative to real pets because they wont die or need mediceine",
      "feedback_text": "I hadn't thought of that!  Are there maintenance costs at all? Check your spelling on \"medicine.\""
    },
    "expected": {
      "quality_score": 1
    }
  },
  {
    "id": "28",
    "description": "allergy_risk_free_claim__gives_affordability_rewrite",
    "source": "Expert sniff test (expert majority score; GEPA-optimized GPT-5.4 prompt agreed)",
    "input": {
      "student_text": "Some people think AI-powered pets are a good alternative to real pets because if someone cannot have a dog due to allergies, they can now have one risk free.",
      "feedback_text": "That's true—AI pets are more affordable than real pets because they do not need food, vet visits, or grooming, so you could revise your sentence to say that AI-powered pets are a good alternative because they cost less to take care of than real pets."
    },
    "expected": {
      "quality_score": 0
    }
  },
  {
    "id": "29",
    "description": "elderly_support_claim__supplies_initial_price_point",
    "source": "Expert sniff test (expert majority score; GEPA-optimized GPT-5.4 prompt agreed)",
    "input": {
      "student_text": "Some people think AI-powered pets are a good alternative to real pets because they are able to help with older people, people with memory loss, and they can still provide emotional support.",
      "feedback_text": "Good work! Cost is a factor. Don't forget that while AI pets have fewer longterm costs, the intial price tag may be high."
    },
    "expected": {
      "quality_score": 0
    }
  },
  {
    "id": "30",
    "description": "better_option_claim__prompts_who_benefits",
    "source": "Expert sniff test (expert majority score; GEPA-optimized GPT-5.4 prompt agreed)",
    "input": {
      "student_text": "Some people think AI-powered pets are a good alternative to real pets because they can be a better option than a real living animal for some people.",
      "feedback_text": "That's true—AI pets are better for some people! Now be more specific. Who might benefit from AI pets as an alternative to real pets?"
    },
    "expected": {
      "quality_score": 1
    }
  }
]
