[
  {
    "id": "marco_polo_grade3",
    "description": "Marco Polo passage, grade 3. Dense proper nouns (Mongol Dynasty, Kublai Khan) and Tier 3 goods (ivory, jade, porcelain) with no contextual scaffolding.",
    "source": "SDK contract capture (sdks/settings/vocabulary/contracts.toml, cases.marco_polo_grade3)",
    "input": {
      "text": "Polo went on a 24-year trip to China with his father and uncle during the Mongol Dynasty. He left Venice at the age of 17 on a boat that went through the Mediterranean Sea, Ayas, Tabriz and Kerman. Then he travelled across Asia getting as far as Beijing. On the way there he had to go over mountains and through terrible deserts, across hot burning lands and places where the cold was horrible. He served in Kublai Khan's court for 17 years. He left the Far East and returned to Venice by sea. There was sickness on board and 600 passengers and crew died and some say pirates attacked. Nevertheless, Marco Polo survived it all.\nSome scholars believe that while Marco Polo did go to China, he did not go to all of the other places described in his book. He brought noodles back from China and the Italians came up with different sizes and shapes and called it pasta. Polo returned to Venice with treasures like ivory, jade, jewels, porcelain and silk.\nHis father had borrowed money and bought a ship. He became wealthy because of his trading in the near East.",
      "grade_level": 3
    },
    "expected": {
      "complexity_score": "very_complex"
    }
  }
]
